,review_id,preview,review,rating,label
12695,11517,Lights of New York was the first all-talking feature film. There had been  of course  The Jazz Singe,"Lights of New York was the first all-talking feature film. There had been, of course, The Jazz Singer, released in Oct. 1927 as the first feature film incorporating synchronized dialog. However, this film released in July 1928 is virtually unremembered for its place in film history. It had started out as a short, but gradually more was tacked on until - clocking in at 58 minutes - it accidentally became the first all-talking feature film. It opened to a grind house run and to Warner Bros. surprise, made over a million dollars. That was good money back in 1928.<br /><br />The plot is quite simple. Two country barbers naively buy into a barber shop on Broadway that fronts as a speak-easy for ""The Hawk"", a gangster. When they learn the truth they can't afford to get out, because the younger barber, Eddie, has all of his mother's money tied up in the place. Kitty is the younger barber's girlfriend, and gangster Hawk (Wheeler Oakman) has an eye for turning in his older girlfriend (Gladys Brockwell) for a newer model - chorus girl Kitty(Helene Costello). A cop is killed while trying to stop the Hawk's men from unloading a shipment of bootleg liquor, and the Hawk sees it as an opportunity to frame Eddie, thus getting Kitty for himself.<br /><br />This early talkie is loads of fun for the enthusiast of these pioneering works. Sure, the plot is elementary and the dialog stilted, but there is something you don't see much of in early talkies - background musical scoring. Vitaphone had originally been used for this very purpose, and here they are still using it for musical accompaniment along with the dialog. And there are singing and dancing numbers! The scenes in Hawk's nightclub are used as an opportunity to show off what films could never do before - musical numbers. There is even a wild-eyed emcee with some heavy makeup left over from the silent era that is a hoot to watch.<br /><br />Vitaphone could not go outdoors at this point due to the static camera booths, so the scene in the park between the two lovers Eddie and Kitty is simulated - and cheaply. The greenery looks like something out of an Ed Wood movie or perhaps a high school production of ""Our Town"". <br /><br />Gladys Brockwell, as the Hawk's castoff girlfriend, delivers her lines with punch. She's a real trooper considering what lines she has to deliver. To the Hawk - ""So you think you can have any chicken you want and throw me back in the deck!"". Huh? mixed metaphors anyone? And then there are her final lines ""I've lived, and I've loved, and I've lost!"" Did someone get paid to write this dialog? Brockwell was making a good success of her talkie career after scoring some triumphs in silent films (the evil sister in ""Seventh Heaven""), when a fatal car accident cut her career short.<br /><br />Then there is Eugene Palette - the older of the two barbers in our story. His frog voice, natural delivery of lines, and cuddly appearance gave him a long career as a character actor usually appearing as a put-upon family man/businessman with a gruff exterior and heart of gold. In fact, Mr. Palette is the only member of this cast who still has a notable career in films just three years after this movie is released.<br /><br />Finally there is the question of ""where is that microphone hidden?"" Microphones were still stationary at this point, and it's fun to figure out where they've hidden it. There is one famous scene, though, where everybody can pretty much figure it out. Hawk is in his office talking to his two henchman - who seem to comprehend as slowly as they talk - about ""taking Eddie for a ride"". If you watch this scene you'd swear the phone on the desk is a character in this film. It's front and center during the whole conversation. The microphone is likely planted in the phone.<br /><br />There is something heroic about these pioneers flying blind in the face of the new technology of sound. You have silent actors who are accustomed to using pantomime for expression, vaudevillians who know how to play to a live audience but don't know how to make the same impression on a Vitaphone camera booth, and you have dialog writers either trying to write conversation as compactly as they did title cards or filling up films with endless chatter. <br /><br />Check this one out. It is not boring, moves fast, and is loads of fun if you know what to look for. And no, I don't expect this one to ever be out on Blu-Ray, but I hope that the folks at Warner Brothers add it to the Warner Archive soon so everyone can see it.",8,pos
34810,4491,"1/10 and that's only because I don't go lower with my ratings.<br /><br />skip this ""movie"" and wait","1/10 and that's only because I don't go lower with my ratings.<br /><br />skip this ""movie"" and wait for the last movie of the ""Trilogy"", don't buy or rent it. trust me you won't be missing a thing. the Architect brings no new info: _(spoiler)_ there have been more NEO's before him, he's like nr.6 or something. you could already figure something like that out from the first movie: Agent Smith telling us the first Matrix created didn't work because it was too perfect. Trinity died and Neo's ""love"" brought her back, where have I seen this before ? Oh right in the first movie the roles where reversed ! same as the action-scenes nothing new just with more opponents. the Action-scene (the 20+ ships) in the BIG battle which we didn't see (maybe in Revolutions ?), betrayed by someone (hmmmm, maybe the guy holding the knife who wanted to stab Neo?!) who pushed the EGM-button to soon.<br /><br />all in all a shameless ploy to make money (especially off the guys who went to see it more then once), which evidently worked like a charm.",1,neg
20402,12411,"This ""TFTD"" episode from season one titled ironically ""Answer Me"" is a pretty well done and memorabl","This ""TFTD"" episode from season one titled ironically ""Answer Me"" is a pretty well done and memorable episode, and it takes a shocking twist at the end. You have Jean Marsh as an over the hill and washed up actress from L.A. who's moved to New York City for an audition and she's living in an apartment provided by an old friend. Oddly every night she's kept awake by a ringing phone from the next door apartment, yet oddly enough the dwelling where the ringing phone continues to ring is unoccupied as the guests have been dead for many years. Finally she has to give in only she should have followed along and not answered the phone with no one home, as it's bad to get wrapped up in a phone with a life of it's own! Overall good episode a strange one though about a supernatural phone still it's suspenseful and it twists well at the end.",8,pos
10255,7680,There are bad movies  movies that are horrible  and then there's a tiny  rarified body of movies tha,"There are bad movies, movies that are horrible, and then there's a tiny, rarified body of movies that are so horribly bad that, even after seeing them just once, the sheer awfulness makes it impossible to forget them even decades later. This is exactly such a movie, and it's hard to believe that the original film in this series was actually quite good. Let's see, George Kennedy, the cigar chomping ""tough guy"" mechanic of the original has somehow been promoted to airline captain, and, after the Concorde comes under missile attack (don't ask), he resorts to stunts like shooting a flare gun out the cockpit window despite (presumably) flying at Mach 2, all the while doing the sort of wild high-G evasive maneuvers that would have ripped the wings off any real airliner, never mind the effect of the passengers! But the absolute worst part of the film, at least to dedicated airplane buffs like myself, is that this atrocity ""starred"" one of the coolest, sexiest, and most technologically remarkable planes ever to fly. The Concorde (or, just plain ""Concorde"" as its pilots refer to it) deserved far better, this abomination is the equivalent of taking a high class beauty like Audrey Hepburn and putting her in a ""Porky's"" sequel. Thankfully, the release of the ever hilarious ""Airplane!"" the following year brought the whole ""Airport"" franchise to a well deserved halt, as anyone even contemplating a fifth installment would have been laughed to death by studios and movie fans alike. <br /><br />1/10",1,neg
1994,898,I did not quite get Barnens O  it is one of the weirdest ones I have watched. The soundtrack was qu,"I did not quite get Barnens O  it is one of the weirdest ones I have watched. The soundtrack was quite unusual as well  written and performed by Jean Michel Jarre - it makes the movie weirder than it was. I have to admit that I was almost going to change it and watch another one instead at times the movie seemed plain dumb to me, or boring  or confusing. There are quite a few sexual references in that movie  trough they too are kind of messed up . Probably the only phrase that I will remember out of it is going to be ""When you are alone, you can control things "" and ""I will show them ""- or something like that .The boy in that movie was obsessed with the idea of not growing up  ""the last summer as a child ""he thought once  and he sure lived it to the max. So if you have few hours to spare you can watch this movie  but you won't miss much if you don't.",3,neg
48468,6610,In 2054 Paris  Avalon  a computer generated system  controls the city and when a young woman is kidn,"In 2054 Paris, Avalon, a computer generated system, controls the city and when a young woman is kidnapped, detective Karas (Craig) must go against Avalon to find her.<br /><br />Renaissance is a splendid blend of film making mixed with a conceptual futuristic narrative that lights up the screen in a shocking manor with a noir themed ideology and conceptual montages that should delight many.<br /><br />Pixar are the animation masters. Their numerous Oscar winning films are endless from the charming Toy Story to the mystifying Wall-E and so any company or director has a real challenge to knock them of their perch. Renaissance isn't a film aimed for the young audience though, and like 2007's Persepolis, brings a strong and mature approach to the genre of animation to make an older and more challenging film to its targeted older generation.<br /><br />In 2005 Robert Rodriguez released a shockingly brilliant noir Sin City that shook up the whole usage of green screen with a splendid balance of filming in black and white with the odd spurts of colour and a year later, Christian Volckman took up a similar approach with this equally visually masterful stroke of film making.<br /><br />Volckman's picture however is a full on animation but it doesn't half look realistic for the majority of it's strong 1 hour and 40 minutes of running time. The faces of the character's are well portrayed and in particular, this film has got to be the finest ever for the usage of shadow. The fact we never know if its night or day is irrelevant when simply gazing into the stony faces as the shadows blend across their expressions. It is almost a clever use of pathetic fallacy, and is finely directed also.<br /><br />For anyone who has seen Persepolis you will have come to the conclusion it is one of the finest directed animations ever screened for the simple but highly conceptual artistic style by Marjane Satrapi<br /><br />Renaissance is equally on terms with that picture and in many instances rivals it with stronger graphics and a darker tone to reflect the mood. One scene in particular when Karas appears out of darkness is beautifully shot.<br /><br />The narrative revolves around a stubborn and nosey political government who keeps tabs on every citizen. The running of Paris is down to the mysterious Avalon which we don't see nearly enough to get an essence of its true dominance. Renaissance is controlling the narrative around a tired cop's attempts to rescue the mysterious woman, and then we see Craig's tired and boring cop attempt a rescue whilst battling with other elements. There are many things wrong with the scripting, not to mention the tired exasperated cop routine is now old, but there is plenty of dashing adrenaline and springy banter between characters to keep it alive right till a wonderfully shot shocking last couple of stages.",8,pos
9413,2858,I was really disappointed after viewing Pinocchio's Revenge the other night. I had a good inclinatio,"I was really disappointed after viewing Pinocchio's Revenge the other night. I had a good inclination that it was going to be a bad one, but I didn't think that it'd be as bad as it turned out. A wooden puppet of a murdered boy falls into the hands of an attorney's eight-year-old daughter. From there, it is a murderous path for anyone who gets in the way between the puppet and the little girl. We've seen movies like this before, i.e. the Child's Play series, which is by the way, far better. However, it was good to see actors like James W. Quinn and Todd Allen. Both of which have worked under Kevin Tenney before. In any event, I encourage viewers to check out ""Night Of The Demons"" and the original ""Witchboard."" These are titles that tend to bring out the best in Kevin S. Tenney.",2,neg
28040,5421,This is one of those topics I can relate to a little more than most people as I hate noise & have no,"This is one of those topics I can relate to a little more than most people as I hate noise & have no idea how those in big cities, New York especially how people get any sleep at all! It astounds me that people can stand all the noise out there these days. The basic plot of the film is that it makes for an interesting topic. It's too bad that's about it. Tim Robbbins is decent although except for a couple of scenes (especially with the absolute supermodel looking Margarita Leiveva) he didn't seem to really be altogether there. My biggest hope for this film is that casting agents will see the absolutely stunning & talented actress to boot, Margarita Levieva. She doesn't have a lot to do, but she is supermodel beautiful. Even when they are trying to make her look at more girl next door. It makes me sad that there can be people such as Paris Hilton & Kim Kardashian in the world w/no redeemable skills or talent, to have more fame and success than this talented beauty. I didn't care for much of this film because the script isn't very good, but am glad I got to see some new talent. I hope that producers & directors think about Margarita when they need a beautiful new actress to be in there big budget film. If they can make Megan Fox a star (c'mon she isn't that hot, & her acting ""talent"" is worse than made-for Disney channel TV shows) from 1 film, it should happen easily for her, as she is gorgeous & has talent! I'd recommend her changing her last name so we can pronounce it and make it more marketable. Here's hoping this makes her career, & if there is any justice she can pop up on some big summer movie or two in the next couple years.",4,neg
43597,418,This a rip roaring western and i have watched it many times and it entertains on every level.However,"This a rip roaring western and i have watched it many times and it entertains on every level.However if your after the true facts about such legends as Hickcock,Cody and Calamity Jane then look elsewhere, as John Ford suggested this is the west when the truth becomes legend print the legend.The story moves with a cracking pace, and there is some great dialogue between Gary Cooper and Jean Arthur two very watchable stars who help to make this movie.The sharp eyed amongst you might just spot Gabby Hayes as an Indian scout, also there is a very young Anthony Quinn making his debut as Cayenne warrior, he actually married one of Demilles daughters in real life.Indeed its Quinns character who informs Cooper of the massacre of Custer told in flash back, the finale is well done and when the credits roll it fuses the American west with American history.So please take time out to watch this classic western.",9,pos
44457,4693,Johnny Dangerously falls completely in the hit or miss category with it's overblown gags and complet,"Johnny Dangerously falls completely in the hit or miss category with it's overblown gags and complete lack of a comprehensive script or story that makes ANY sense. But that's the point, right?<br /><br />The cast is likable; Michael Keaton an excellent comic performer before he took himself too seriously as the years passed. Griffin Dunne, Peter Boyle, Joe Piscopo, Marilu Henner and Danny DeVito all perform with enthusiasm and at least get a lot of laughs from me. But the complete scene stealer here is Richard Dimitri (sneaking the word ""Iceholes"" into movie history) as a mobster who fares best at murdering the English language.<br /><br />I associate many childhood memories with this film, as I watched it quite often so maybe I'm prone to enjoy it more than many others. Johnny Dangerously is at least a completely innocent gangster film spoof that even relays some well meaning messages about the dangers of smoking (and sex).<br /><br />I like it but it's hard to recommend.<br /><br />7 out of 10.",7,pos
35724,9470,Film critics of the world  I apologize. It is your job to give advice to the moviegoing public so th,"Film critics of the world, I apologize. It is your job to give advice to the moviegoing public so that they can wisely choose what to spend money on. But I ignored your advice and I have been deeply hurt. However, my decision to see ""The Cat in the Hat"" wasn't made haphazardly. You see, three years ago all of you critics said that we should all avoid the ""calamity"" known as ""How the Grinch Stole Christmas"". Then some friends of mine took me to see it and it turned out to be a colorful, funny and almost hypnotic yuletide treat. So when the critics unleashed their fury against ""The Cat in the Hat"", another big budget Seuss update with a big name star in the title role, I thought that it must be the same old song. How wrong I was.<br /><br />For five whole minutes I thought I was in the clear. The opening credits are clever, the kids are charming and the production values are top notch. Then the cat showed up. There are many problems from this point on, but the biggest one was the woeful miscasting of Mike Myers. Where ""The Grinch"" was saved by the inspired casting of Jim Carrey, ""The Cat"" was destroyed by Myers. He can be very funny when his energies are applied where they belong, comic sketches. Every movie he's made that was truly funny was really just a feature length comedy sketch, from ""Wayne's World"" to ""Austin Powers"". So he tries to do the same thing here, it's just that these comedy sketches are more like the stuff that they stick at the end of SNL, not funny, just painful. Not that the writers helped him out any. After the charming prologue the movie turns into an hour of repulsive bodily humor gags, poorly timed pratfalls and insultingly stunted attempts at hip humor. This movie was the most disheartening cinematic experience I have ever had. Period. So much talent and work went into something so vile. I know that the adult stars of this movie will be relatively unscathed by this mess, I just hope that the wonderful Spencer Breslin and Dakota Fanning will get more chances to show their charms in far better movies. If you are a parent, please avoid this like the plague. With movies like ""Elf"" and ""Brother Bear"" currently in theaters, you have far better choices.",1,neg
47348,8762,"""What would you do?"" is a question that will stick in your mind for weeks after watching the emotion","""What would you do?"" is a question that will stick in your mind for weeks after watching the emotional Brokedown Palace. You will also be left wondering if Alice (Danes) was telling the truth or not - a issue that is left unresolved, and rightly so. This is a particularly well acted and beautifully shot film. Although it is slow at times, its pace is reflective of the story line - but a lot of the film will have you on the edge of your seat; wanting to know what happens next. The ending will also leave you imagining yourself in the shoes of the lead characters, which are brilliantly played by Kate Beckinsale and Claire Danes. Bill Pullman's performance is commendable, too.",8,pos
10236,3858,There is a famous short story about a man who becomes the prey of a safari hunter who has lost inter,"There is a famous short story about a man who becomes the prey of a safari hunter who has lost interest in hunting anything except humans. Its quite good, and its been done and redone in film and TV many many times. Some are notable, but this urbanized version, that injects the tired old racism themes, just flat out stinks. Leguizamo's slapstick is almost as weak as the unfunny script. Chaplin, this guy isn't. There must be people who find a dwarf who cant stop dancing funny, I mean I suppose it is funny in a pathetic freakish way, but its just not enough to carry a movie. You have the usual Nazi holdover or neo-Nazi whatever the heck we are supposed to think, type villain, who's son of course is gay, German accents...get the picture?",1,neg
17949,6442,For years i've had a distant memory of watching this film   i looked on the net to find it somewhere,"For years i've had a distant memory of watching this film , i looked on the net to find it somewhere and couldn't find it anywhere so i thought it must have disappeared.<br /><br />UNTIL...my gran showed me a box set she sent off for in the Daily Mail and i though nah there wont be anything decent in there, but to my great surprise there amongst other gems was The Water Babies! I hadn't been that excited ina long long time! Its a great light hearted film, the songs aren't memorable probably if i was a child during the time it came out i would have stuck in my mind more. Sadly it was just a film i watched at my grans 10 years ago when i was a little spud. And watching it back now the animation is terrible! and the re-recored voices they do to get a richness to the sound in films is totally off! But who cares when your a kid you never think of those things, even if they lead boy is about 10 and sounds like a boy in the middle of puberty.<br /><br />Great classic kids film!",8,pos
12733,2822,I'm surprised by some of the comments on this site because I really liked this film. If you're looki,"I'm surprised by some of the comments on this site because I really liked this film. If you're looking for something different then this movie is a good choice. Definitely not your typical mindless story that seems to be everywhere starring Ben Idiot Affleck or some other Hollywood loser. It's an intellectual film, you actually need to pay attention so some people might be turned off by that. However, if you are looking for something that keeps you on your toes then this is a good choice. Warning to parents - it has some fairly graphic sex scenes so watch it once the kiddies are in bed. People who like Euro flicks will like this one. Adam Sandler fans should skip it because it will be over their heads and definitely NOT their style.",9,pos
14560,5772,This zany film rivals the Ghost and Mr. Chicken as one of Don Knott's finest film performances. Knot,"This zany film rivals the Ghost and Mr. Chicken as one of Don Knott's finest film performances. Knotts is an accountant for a Podunk city hall that is good for swindling the citizens. They fire the ""three competent bookkeepers and keep the dumb one"" (Knotts of course is the dumb one). When his garbage collecting cohort accidentally empties the wrong trash can, Knotts finds himself wrapped up in a bizarre trap set by the city council for him. Funny moments in the movie include the Bowling Alley Restroom scene, and the cemetery scene is absolutely hilarious. Typical Knotts, the nervous ninny act is well used, and as usual he is surrounded by lots of crazy character actors from the sixties. Such actors as Frank Welker, and Pitt Herbert add to the mayhem. As one may expect Knotts's armed with a big car, a pretty girl, and no real clue of what he's doing. Fun for anyone, especially nostalgia buffs, but just about anyone will love it.",9,pos
