,review_id,preview,review,rating,label
42782,12368,"I had the TV on for a white noise companion and heard"" $400 for a fully furnished apartment"" So I ra","I had the TV on for a white noise companion and heard"" $400 for a fully furnished apartment"" So I ran into the TV room expecting another 70's flick and got much more. Luckily, I could rewind to the beginning (DVR buffer) and hit the record button to watch it entirely.(Cinemax uncut and in HD no less!) Aside from some holes in the story and intermittent improbable dialog/events, this is an effective thriller worthy of your time to watch. Pretty creepy and progressive at times: Beverly D'Angelo's character masturbates in front of Alison Parker, played adroitly by Cristina Raines, Parker stabs, in very gory fashion, her father, an explicit menage a trios scene.( don't let the kids watch) The film is TOTALLY 70's full of bad clothes(polyester suits and tacky ascots) and decor, bad hair,over bloated music score, and familiar looking cinematography. The cast is excellent, take a second on this film's home page to check it out.It was a surprise to see Christopher Walken, Jerry Orbach and Jeff Goldblum so young. Sylvia Miles- always wonderfully creepy! ENJOY!",8,pos
14132,533,Adam Sandler's movies are my favorite comedies. The Silence of the Lambs is my favorite horror movie,"Adam Sandler's movies are my favorite comedies. The Silence of the Lambs is my favorite horror movie. The Matrix is my favorite sci-fi movie. Anywhere But Here is my favorite drama.<br /><br />Perhaps the single most valuable asset that this movie has is it's acting.<br /><br />Susan Sarandon is absolutely amazing. By the end of this movie I felt as if I knew her character better than I knew myself. She did a simply amazing job.<br /><br />Natalie Portman also did a great job. I recently rented her first movie, Leon (1994), in which she played a 12 year old girl. I believe that she is a contradiction in terms; she was a good kid actress. Well, 5 years later she is still just as good an actress. In fact, she's much better.<br /><br />Not only did Sarandon and Portman portray their characters well, but they also worked perfectly together. I mean, even now I can hardly believe that they are not actually mother and daughter in real life as well as in this movie.<br /><br />This movie is about a 14 year old girl (Portman) and her restless mother (Sarandon) that leave their home town in Wisconsin for Beverly Hills.<br /><br />At first Portman hates her mother for taking her away from her cousin and friends, and the two begin a very tumultuous relationship that goes up and down over the course of a couple years (usually down, might I add).<br /><br />Although this explanation is a little vague, the plot can only be summarized vaguely. But when you see this movie you will see that the plot really is not so vague or weak, for it is actually very deep. What I am saying is that the plot is outlined weakly, but then they focus in on it to make it strong.<br /><br />And it is very strong, but also the plot sequencing is great. And there are a few brilliant scenes that I hope will someday be seen as ""classic"".<br /><br />I loved this movie. I laughed. I cried. And although, admittedly, there are a few loopholes, it's still a stellar movie and it really comes together in the end.",10,pos
13224,7935,Eisenstein describes his collaboration with Prokeviev as an equal partnership  where they worked tog,"Eisenstein describes his collaboration with Prokeviev as an equal partnership, where they worked together to match image and music, scene by scene. Unfortunately, the sound recording was a disaster, so for once the devotion to authenticity in Criterion DVD's backfires. Fortunately, there is at least one restored version of the film on VHS (BMG Classics) with an excellent re-recording of the music (by the St. Petersburg Philharmonic Orchestra and Chorus).<br /><br />It is interesting to compare this film with contemporary propaganda films in England, Germany, and the United States. Eisenstein's film was made in 1938, in response to the fear of a German invasion; and Olivier's in 1943, when a German invasion of England was still expected. Both films are stagey, but in different ways. Olivier begins by showing a staged performance of the play in the Globe Theater by Shakespeare's own company, then takes us out of the theater to a more cinematic (though still stylized) setting. Eisenstein's film is cinematic from the beginning, but the dialog and speeches are still influenced by the melodramatic acting conventions of the old Russian theater. This works very well for Cerkassov's speeches as Alexander, because part of his job as a prince and military leader was to play a role in public.<br /><br />In Nazi Germany, the first major propaganda film was Leni Riefenstahl's tedious Triumph of the Will, which recorded a huge political spectacle - massed crowds cheering Hitler's ranting speeches. The propaganda in her masterpiece, the film of the 1936 Berlin Olympics, is much subtler, with its worship of the athletic male body carrying disturbing undertones of the Aryan superiority myth. But wartime German propaganda films could also be subtle. Karl Ritter's Urlaub auf Ehrenwort (Furlough on Word of Honor) is typical. It shows a young lieutenant letting the men in his company go on a 24-hour leave before returning to the WWI trenches (and almost certain death). Against the advice of veterans, he accepts their word of honor to return, though he will be courtmartialed and shot if they don't. Naturally, they all return, (though some of them berate themselves for it), presumably inspiring the audiences to similar displays of duty to their country.<br /><br />In the United States, one of the better WWII propaganda films was Howard Hawks' Air Force. In it, we follow the mismatched crew of a bomber as they bond to each other with the experience of battle, and overcome obstacles to continue their part in the war. Typically for Hawks' films, however, their real loyalty is more to each other than to their country.<br /><br />Eisenstein has to reach far back in history to find any Russian military triumphs. Ironically, Alexander (like the other Russian princes) is descended from the Vikings who sailed up the Russian rivers to conquer and rule their own fiefdoms. So he is a conquerer repelling another would-be conquerer. Physically, they are not that different (though the actors portraying the German princes were obviously chosen for their ugliness and smirking stupidity). But the real contrast is between the common soldiers. The Russian peasants are as tall and strong as the nobles; whereas the German peasants who scuttle out of the shield wall to kill wounded Russians are a foot shorter than their masters. There is some historical truth in this contrast. Russian serfs in the Middle Ages were much better off than their European counterparts, because they could always escape into the wilderness and clear their own land.<br /><br />Eisenstein's film also cleverly gives us our first sight of Alexander as a fisherman. In the battle with the Germans, he uses his fisherman's knowledge of the ice as well as his knowledge of their military tactics to defeat them. When Gavrilo breaks the shield wall, they are forced to regroup and mass on the West side of the lake, where the ice is thinner.<br /><br />One of the other pleasures of Eisenstein's film (which most audiences miss) is the historically accurate way that he portrays the politics of medieval Russia. Cities like Pskov and Novgorod owed their growing wealth and prominence largely to trade, which put the merchants into power, and sidelined the princes until their military expertise and feudal levies were needed to repel invaders. In the film, Alexander is shown not only as a military leader, but also as a master politician, who knows how to wait for his time, and how to make the most of his popularity after the victory.",9,pos
23792,4172,"Symbolism galore  great tunes  this film crushed their ""soon to be no more"" target audience's expect","Symbolism galore, great tunes, this film crushed their ""soon to be no more"" target audience's expectations. These monkees and the naturally selected members of the group, were witnessing a subtle yet in your face, kiss goodbye to each other. The message rings true today, the cage you escape from and the bridge you want to jump off of, are the next generations own disappointments, there will always be new kids on the block replacing those who break free from the chains. The film can be frustrating at times, because the themes the film attacks are so blatantly apart of the American way of life, a thinking and reasoning person cannot help but stare at their own reflection in the scenes of Head, and question not only their personal motives for continuing the madness of everyday American life, but the motives of those who want it to continue for the sake of madness. The final scene, similar to Don Quixote's chivalric daring of the caged tiger to exit for battle, represents just how delusional and impossible most dreams are.",10,pos
4271,5933,"Lou Gossett  Jr. is an excellent and captivating actor  but to have him take the role of a ""presiden","Lou Gossett, Jr. is an excellent and captivating actor, but to have him take the role of a ""president"" and then have him act like he's James Bond, running around carrying a Gun and entering a warehouse to uncover a plot to kill Christians, and then being able to Escape the supposedly High Security Facility to live another day, does Not do him Justice - this movie has so many Unresolved Issues<br /><br />I will attempt to list just a few: <br /><br />1 - what was the purpose of ""stockpiling"" a Vaccine if no one is Vaccinated? - for example, the preacher could have been Vaccinated if the ""tribulation force"" already had Vaccine on hand - later, buck Williams' wife goes to be with the sick preacher and she herself becomes sick; so, was the Virus, therefore, Contagious? - IF it was Contagious, then why did Ray and his wife go into the church without Proper Protection? - why didn't they become Sick too? - and when Chloe drank the wine and was ""cured"", how did she suddenly know the wine was the ""antidote""? - was it California wine, ordinary Red Table Wine? - could Red Grape Juice been adequate - and,if the preacher had received ""communion"" at least every time he preached, maybe he would have had anti-dote flowing through his body already? - buck and Chloe got a ""heavy"" box of vaccine that was never used - what mysterious message should we see in that? <br /><br />2 - the presentation of ""evil"" forces who are working with the Anti-Christ Nicolai to destroy the world, as being Russian, Chinese, etc., is really a Relic of the 1950's and the early James Bond era, and shows an Ignorance of Modern Society and of Humanity - are we to believe that Russians and Chinese are perpetually trying to destroy this Planet? - and for what Purpose, mere Destruction? - this was such a Narrow-Minded view of this world and was so Cliché as to be Laughable<br /><br />3 - the main purpose of this movie was the scene near the very end where Kirk Cameron and Lou Gossett, Jr. are proselytizing the non-believers in the audience (by showing Kirk proselytizing Lou) - it was a movie with no meaningful storyline, too many disconnects with reality, and a completely inappropriate plot for a great actor<br /><br />I, therefore, rank this as a 1, since Zero is not available",1,neg
9727,1032,Although the figures are higher in proportion to other areas of society  I don't object to the extre,"Although the figures are higher in proportion to other areas of society, I don't object to the extremely high salaries for many of today's entertainers and athletes.<br /><br />A-Rod, LeBron or Brady all have deals either well with 8 figures, or the low-9 area. Ray Romano and Jerry Seinfeld could actually become billionaires from their shows, huge residuals and fees they currently demand. Even their cast members, and all of the ""Friends"" group reached near or over 7 figures per episode. Letterman's earnings for one show could solve most people's financial problems, and a week or two's take care of many for life.<br /><br />But all of these are based upon sound supply/demand principals, and the financial benefits they bring to their employers. And all perform their crafts ably.<br /><br />But then comes along someone like Rachel Ray, who reaches a level of earnings far beyond any apparent level of talent or skill. I find her shrill, annoying, and with a forced ""perkiness"" that's as phony as the proverbial ""3-dollar bill.""<br /><br />A friend of mine is responsible for special meetings, events and convention plans for her firm and its affiliates. One of the major talent sources has hundreds of clients available from the $5-10K level, to a handful who get $200K and up per appearance. (This area includes Trump, Seinfeld, Lance Armstrong, Robin Williams, and, no kidding, Larry the Cable Guy.)<br /><br />There are a greater number in the $100,001 - 200,000 range; list included the likes of Bill Cosby, Steve Martin and even cable guy Larry's benefactor, Jeff Foxworthy. <br /><br />This category includes Rachael Ray. I suppose I have to admit there may be sufficient demand for her ""talent"" and offerings to justify her talk show and there may be some out there who'll pay more than $100K, + first class air, hotel suite, all expenses and limos door-to-door, for just a couple of hours of her whiny prattle at their organization's event. <br /><br />I just can't figure how-in-the-hell this could be possible.",1,neg
25467,9152,Intrigued by the synopsis (every gay video these days has a hunk on the cover; this is not necessari,"Intrigued by the synopsis (every gay video these days has a hunk on the cover; this is not necessarily to be construed as a good sign) I purchased BEN AND ARTHUR without knowing a thing about it. This is my second (and I assure you it will be my last) purchase of a CULTURE Q CONNECTION video. As far as I am concerned, this DVD is nothing but a blatant rip-off. I do not make this observation lightly  I am a major collector of videos, gay and mainstream, and I can state with some authority and without hesitation that BEN AND ARTHUR is quite simply the worst film I have ever sat through in my life. Period. My collection boasts over 1,600 films (93% on them on DVD) and of those, well over 300 are gay and lesbian themed. I hardly own every gay movie ever made, but I am comfortable in stating that I pretty much purchase almost every gay video of interest that gets released, and very often I buy videos without knowing anything about the film. Sometimes, this makes for a pleasant surprise - Aimee & Jaguar, It's In The Water, Urbania and Normal are all examples of excellent gay titles that I stumbled upon accidentally. So when I read on the box that BEN AND ARTHUR concerned a conflict between gay lovers and the Christian Right, one of my favorite subjects, I decided to take the plunge sight unseen, despite my previously disappointing purchase of another CULTURE Q CONNECTION title, VISIONS OF SUGAR PLUMS. That film was pretty bad, but compared to BEN AND ARTHUR, it viewed like GONE WITH THE WIND. So what was so wrong with BEN AND ARTHUR? Plenty! To begin with, the ""plot"" such as it was, was totally ridiculous. This film almost made me sympathetic to the Christian Right  we are asked to believe not only that a church would expel a member because his brother is gay, but that a priest would actually set up a mob style execution of a gay couple in order to save their souls (like this even makes sense). The writing is so poor that many scenes make no sense at all, and several plot points reflect no logic, follow-up or connection to the story. Murder and violence seem to be acceptable ends to the gay activist / right wing conflict on both sides, and the acting is so bad that it's difficult to imagine how anybody in this film got hired. The characters who are supposed to be straight are almost without exception clearly gay - and nelly stereotypes to boot; the gay characters are neither sexy nor interesting. This film is enough to put off anybody from buying gay themed videos forever, and the distributors should be ashamed of themselves. The only advantage this picture has over my other CULTURE Q Connection purchase, VISIONS OF SUGARPLAMS, is that this one has a soundtrack with clear dialogue. Hardly a distinction, since the script is so insipid that understanding the script only serves to make you more aware of how bad this film truly is. It is an embarrassment to Queer culture, and I intend to warn everyone I possibly can before they waste their money on it. At $9.95 this film would have been way overpriced; I understand that it's soon to be re-priced under $20, which is STILL highway robbery. I paid the original price of $29.95, and I never felt more cheated in my life. The only true laugh connected with this drivel is the reviews  I have seen ""user reviews"" for this film on numerous websites, and there is always one or two that ""praise"" the director / writer / actor in such a way that it's obvious that the reviewer is a friend of this Ed Wood wannabe. How sad. How desperate. I just wish IMDb would allow you to assign zero stars - or even minus zero. If ever a film deserved it, this is it.",1,neg
37024,4713,As you can guess by my rating and my title of this review that I don't like Johnny Test. Now I think,"As you can guess by my rating and my title of this review that I don't like Johnny Test. Now I think I know what people are going to say, "" How do you know how bad it is? Have you ever watched it?"", I did watch this show a couple times because I am studying film and animation and this just doesn't hold a candle to my standards.<br /><br />I want to first talk about the animation because it is one of the most confusing things I have ever seen. Like the first two seasons or only first season had hand drawn animation. I thought it was a nice show to look at when it was hand drawn but then it switched to flash animation and the quality went down by a huge amount.<br /><br />So that is one strike in my eyes but lets look at the story of the show. It tries way too hard to be like Dexter's lab but there are differences because instead of one red headed scientist there is two and they are both female. There is a talking dog(why?), and the parents attitudes are switched somewhat. I have others but I don't think I can write them here ( I don't mean cursing but I mean I don't know if there is a limit for words.). Everything else though is spot on, even a DeeDee character Johnny himself. It just tries so hard to be Dexter but it just seems to me like a heartless knockoff.<br /><br />Lastly I want to talk about the jokes. Remember in Dexters lab some of the jokes involved yelling? Yes, yelling can be good for a joke or two but Dexter's lab also had sly remarks that made me have to go back and check to get the joke. Johnny Test just forgets all that and just yells 50% of the time and stops the music whenever a stupid joke or one liner appears. That isn't comedy, thats stupid comedy (I know what some people are thinking. Isn't three stooges stupid comedy? Watch that and Johnny Test back to back and you laugh more at the first option.). Sometimes the jokes are based on bizarre situations which, like Chowder, makes me mad. I have a rule for cartoons and comedies all together: To much bizarre doesn't equal comedy, it makes you just think ""what am I watching?"".<br /><br />So it strikes out on all accounts. Don't watch this show if you have any respect for comedy in anyway, shape, or form.",3,neg
45469,1552,I saw this film by chance on the small box. It has a fantastic and chilling scene about poisonous ga,I saw this film by chance on the small box. It has a fantastic and chilling scene about poisonous gas. A lot about fanatical patriotism. A bit of eroticism. I can't believe it's still waiting for 5 votes!!,8,pos
14702,10098,This movie certainly deserves to be placed within the genre of horror  but not for obvious reasons. ,"This movie certainly deserves to be placed within the genre of horror, but not for obvious reasons. The horror of ""A Tale Of Two Sisters"" lies not with sudden shocks or large helpings of CGI guts and gore; it is a psychological horror movie which piques the viewer's curiosity from the start and builds a suspenseful aura of mystery and questions throughout. Best of all, the ending does not provide a clear answer, pushing the viewer to analyse what they have seen and make up their own mind about what really took place.<br /><br />Do not be put off by the seemingly slow pace at which the movie begins, and don't expect to be jumping out of your seat immediately. This is not the conventional hack-and-slash movie with orchestral stings designed to make you scared of nothing in particular. ""A Tale Of Two Sisters"" slowly builds an atmosphere of terror, a terror of the unknown and a fear of things which evade explanation until the very end. Even when the final conclusion is revealed, it is not so heavy-handed and obvious as to make the entire film fall neatly into place. The movie requires its viewer to reflect back on what they have seen and to try and square this with the frightening revelation of the final scene. Some things will still be open to interpretation, and this is one of the joys of watching a film such as this.<br /><br />The true fear of ""A Tale Of Two Sisters"" lies not in shocks or conspicuous scares; it is a psychological, gut-wrenching horror that defies convention and expands a genre to proportions hitherto unexplored by the traditional horror film. It is no exaggeration to say that this film stands apart even from the so-called 'Asian Horror' genre. Indeed, it would be a mistake to align ""A Tale Of Two Sisters"" with films like ""Ringu"" and ""The Grudge"". This movie can be understood from a variety of standpoints, some requiring no suspension of credulity, others embracing the supernatural wholeheartedly.<br /><br />Whichever way you choose to interpret this film, it is one that demands an open-minded approach, rewarding viewers regardless of their preconceived notions on Asian cinema or horror in general.",9,pos
36,6945,This was one of the worst movies I've ever seen in my life. They said this was the man's answer to W,"This was one of the worst movies I've ever seen in my life. They said this was the man's answer to Waiting to Exhale...All I'm going to say is that we really didn't respond at all. I couldn't believe that it was actually made. The director should choose another profession, because he can't make a movie. The script wasn't good. It made no sense and was very messy. Bet movies are much better than this was, and I was horribly disappointed to see the talented actor Terrence in this bad excuse of a movie. If I could turn back the hands of time I wouldn't go back to Media Play to never buy the movie, I would just keep it wrapped sitting on the shelf, instead of wasting my time watching it.",1,neg
43162,8942,A number of contributors have mentioned the age difference between Stewart and Novak. She was 25 and,"A number of contributors have mentioned the age difference between Stewart and Novak. She was 25 and he was 50 when this movie was released. I think that the difference didn't matter for a suspense drama like Vertigo, but it does matter for a romantic comedy. We can easily understand, that is, why his character would be attracted to hers, but it's less clear why hers would be attracted to his.<br /><br />Still, the movie works as a light romantic fantasy. The scene where she stares at him across the cat's head, with her dark painted-on eyebrows flaring and the sounds of her humming and the cat purring, is true magic. It's a little jarring, therefore, when the scene shifts to the top of the Flatiron Building, and we see the age difference very sharply. As he embraces her, she reaches up to run her fingers through his hair, but stops that motion and just brushes her fingertips lightly against his toupee.",8,pos
17672,915,Most of Kieslowski's films seem like puzzles to me  meant to expand mind and soul. The characters ar,"Most of Kieslowski's films seem like puzzles to me, meant to expand mind and soul. The characters are not very believable, are idealized, are schematic. Nevertheless, the way Kieslowski presents their winding ways through life, their complicated interaction with others, with the universe, with chance or destiny, makes me understand faith, makes me (want to) believe in God. That at some point it all has a meaning, if not to me, then certainly to someone.<br /><br />Trois couleurs and especially ""Rouge"" comes closer to making me touch, feel, experience the ""truth"", the ""meaning"" than perhaps any other of his films. The only problem being the paths of the ""puzzles"" explored are a bit too similar to his other films and at some point they become somewhat predictable. There is still plenty of joy to be had here. It is like a familiar brand of wine - you know what to expect and it delivers, sometimes with a newly found bouquet which might come from aging - either the wine or yourself.",10,pos
