,review_id,preview,review,rating,label
36556,4986,Everybody who wants to be an editor should watch this movie! It shows you about every mistake not to,"Everybody who wants to be an editor should watch this movie! It shows you about every mistake not to do in editing a movie! My grandma could have done better than that! But that's not the only reason why this movie is really bad! (It's actually so bad that I'm not able to write a sentence without exclamation mark!) If the first episode of Les Visiteurs' was a quite good familial comedy with funny jokes and cult dialogues, this sequel is copying badly the receipe of the first one. The funny parts could be counted on one hand and maybe half of it. Clavier is over-acting his role even more than in the first part, Robin is trying to act like Lemercier (because she's replacing her) but that's grotesque'. Lemercier is Lemercier, Robin is Robin! Even if Muriel Robin can be funny by herself on stage, she is not in this movie because she's not acting as she used to act. I know that it should be hard to replace somebody who was good in a role (Lemercier obtained a César award for her role in the first movie) but she made a big mistake: instead of playing her role, she played Lemercier playing her role'! As for the story, it's just too much! Of course we knew at he end of the first movie that there would be a sequel but Poiré and Clavier should hae tried to write a more simple story like the first episode. The gags are repetitive, childish and déjà-vu. No, really, there's no more than 3 funny parts in this. The only good things might be the costumes and some special effects. So you have only 2 reasons to watch it: 1) if you want to learn how to edit awfully a movie, 2) if you want to waste your time or if you really need a brainless moment'! 2/10",2,neg
24393,8557,We don't know why this extraordinary film was never made available officially on DVD... Anthony Quin,"We don't know why this extraordinary film was never made available officially on DVD... Anthony Quinn's performance alone makes this a must-see. There are relatively few films in which an actor identifies so profoundly with his character, a phenomenon always unique for us, moviegoers.<br /><br />But Quinn's powerful portrayal of an innocent Romanian, literally dragged out of his house and everyday life by forces he cannot comprehend, is only part of what makes this film great. The script is based on a book published in Paris by a Romanian priest who fled the Communist take-over of his country, and the film succeeds to go deep into a little known area of East-European history. Told as a succession of Kafka-esquire twists of fate, the misadventures of Johann Moritz (told openly and honestly, without any of the political correctness currently so precious in Hollywood) are in fact a eulogy for the lost innocence of the Romanian people... it is devilishly ironic that this eulogy is signed by a French director, working with the American money of an Italian producer, and overseeing a multinational cast fronted by an extraordinary Mexican-born thespian.<br /><br />I've seen mentions of VCDs of this film in various Asian internet stores, and I was fortunate to take possession of a digital recording of this film, broadcast on the British version of TCM. But it's a shame that ""The 25th Hour"" isn't anywhere on the future DVD release map of MGM studios.",10,pos
9908,234,The Kid was born retarded. It pulls in a half-dozen directions  features dialog and action lifted fr,"The Kid was born retarded. It pulls in a half-dozen directions, features dialog and action lifted from much older and better-known flops, and might be funny -- if only the writers knew what funny is.<br /><br />Disney stuff has gotten a lot better in the last couple of decades, but don't let that fool you. They should have given The Kid a wide berth, sang it a lullaby, then ran the train into a ravine. Mercy killing.",3,neg
10976,11863,I like dark humor and non-PC stuff  but not if it is with no purpose but to elevate yourself. Bashin,"I like dark humor and non-PC stuff, but not if it is with no purpose but to elevate yourself. Bashing a group of people without any trace of self-irony is crap.<br /><br />There are people who could make concentration camp jokes funny, but whoever made this film unfortunately failed even in the VERY easy task of making fun about Turks in Germany. It is a very easy task, but if your are the Germany equivalent of an inbred redneck (=inbred Southerner from a village where virginity is often lost to farm animals) you certainly will fail at this and also at life. I have heard and seen so many funny stuff about minorities in Germany, but this ""movie"" (this piece of crap being listed here is an insult to the next worst movie) sucks like the calf the makers of this movie met some years ago.",1,neg
23618,9355,Crossfire is a fantastic film noir that is both a product of it's time and a timeless classic. This ,"Crossfire is a fantastic film noir that is both a product of it's time and a timeless classic. This film achieves this by addressing issues that haven't been brought to the screen before its 1947 release, and by being a high quality film that holds up to this day with a good script, great look, and fantastic performances from it's actors. The first American film to take the issue of anti-Semitism head on, Crossfire is cemented in classic standing. Set in post-World War II America, a lurid whodunit develops after a Jewish man is found murdered.<br /><br />The story is great, its anti-hatred theme wrapped up in a dark multiple-character crime thriller, and along side the anti-Semitism angle is some great post-World War II dialogue and themes as well. Unlike other mystery thrillers, the audience is alerted to who the perpetrator is almost immediately. However, the film's story is still engrossing because of the struggle of all the great characters involved are going through while trying to make sense of the situation. Outside the great overall story and themes, the entire script is simply smart, complete with meaningful messages and razor-sharp exchanges between characters.<br /><br />The film's captivating story is played out wonderfully by the its excellent cast. Robert Young is fantastic as Capt. Finlay, the leading investigator of the murder case. Finlay's my favorite character of the film, he's just a cool character - dry as bone and tough as a two-by-four and stopping at nothing to bring the killer to justice. Robert Mitchum is also great in the film, very vivid in his soft-spoken army sergeant character due to his superb screen-presence. Gloria Grahame gives a memorable performance in her small Oscar-nominated role; George Cooper also does a good job as the sick and distressed Corporal Mitchell; Paul Kelly gives an eerie portrayal of a bizarre character; and Steve Brodie, Sam Levene, Jacqueline White, and William Phipps also give strong supporting performances. Robert Ryan ends up being the most talked about performer of the film, giving a chilling performance as Montgomery and also being nominated for an Oscar.<br /><br />Crossfire has a terrific look. Director Edward Dmytryk does an extraordinary job with the film's execution and cinematographer J. Roy Hunt does a masterful job with its black and white picture. Crossfire's picture is as dark and dank as its themes, covered in shadow with an almost glossy overtone, yet also very raw in parts. Ironically, the film's great look was not the result of hard work - or even intention. Dmytryk wanted to spend more time and money on the actors rather than the lighting - so that's what he did. Less lights, less preparation (around a 6 hour work day), and it resulted in a fantastic looking film. Not just a well done piece of cinematic art, Crossfire is also a great example of a cheap film that ends up a rich classic.",10,pos
40803,9213,Gómez Pereira is the responsible for some of the most despicable comedies of latest Spanish cinema (,"Gómez Pereira is the responsible for some of the most despicable comedies of latest Spanish cinema (just take a look at his curriculum vitae), so I didn't expect that much of ""Cosas Que Hacen...""... In fact I don't know why in the world did I decide to watch it. Anyway, I just did... And what a surprise. It looks that Gómez Pereira has finally matured and now he's capable of making a good movie. He's last work deals with the midlife crisis, the disappointing, and the seeking for a second chance after you've ruined it all. The last half hour of the movie (the more dramatic) is the best part, and it just makes worth watching the film. Also we have Eduard Fernandez playing the main role, and I keep on thinking he's the best actor of his generation (by far).<br /><br />*My rate: 7/10",7,pos
6384,1483,One of those movies where you take bets on who will die first and who will survive at the end. There,"One of those movies where you take bets on who will die first and who will survive at the end. There was just something about the movie that made me zone out. I think because I keep looking back and thinking ""yep still in that tree...still looking at the water"". Poor character development. I felt nothing when they were in danger. I was voting for the croc. I found it hard to believe a croc would try to tip a boat in the first place and then when it jumps into the boat I find that really unlikely as well. The croc seems too supernatural at times ('all knowing all seeing'). Also when the croc attacks it's behavior seems very unrealistic. It's a killing machine and wouldn't be letting victims escape twice to three times in a row, especially when attacking in the water.",3,neg
18881,2199,The story of Sweeney Todd evokes memories of the work of classic writers like Charles Dickens  and m,"The story of Sweeney Todd evokes memories of the work of classic writers like Charles Dickens, and more contemporary writers like Edward Gory. As a musical, it naturally becomes more like the musical Les Miserables. Both deal with the grim effects of poverty in the Industrial Revolution, and the breakdown of organized society. But this musical is different from Les Mis in one very important aspect: Stephen Sondheim, the songwriter who can adapt to any style. To be sure, he's had his successes and failures, but one thing about his shows you can always count on: They will be something unique. Who would have thought someone would write a musical about a barber who slits people's throats and makes them into meat pies? Sondheim did, and he did it marvelously. The entire show is set in a factory, to suggest the ever-present catastrophic effects of the misery of those at the bottom of society, and this serves the needs of the show perfectly. The catwalks and railings are moved throughout to suggest streets and walkways and bridges. Techniques are borrowed from Kabuki and Noh, with the visual stagehands and set changes. Then, to top it all off, cast the great Angela Lansbury as the gruesomely practical and humorous Mrs. Lovett, and George Hearn, with his operatic baritone voice, as the murderous Todd, and you've got yourself a stellar musical vehicle. The rest of the cast moves smoothly through the clichés of the love story perfectly, except for Johanna and Pirelli, who sound a bit too forced. If the Johanna and Pirelli from the Broadway show could be here, it would be perfect. Hearn acts while he sings more than Len Cariou on the OBC album, and the accents don't sound as forced here. Through it all Sondheim's score never fails to underline the dark seriousness of the story. As I said, he can adapt to any style. In Follies he imitates the '30s '40s style of showtunes, in Pacific Overtures he captures the subtle art of Asian music, Into the Woods knocks off the 32 bar Disney style songs, and Assassins covers a history of American music. Here, however, he does wonders in making his score distinctly English, from parlour songs to operatic duets and soliloquies to society waltzes to Gilbert/Sullivan style patter. And yet still, the show remains deadly serious, even though it provokes more laughs than any musical comedy. In it still, is a grim warning on the evils of taking revenge. Here is where this movie makes a mistake, in cutting the Judge's solo in which he flagellates himself out of guilt for his crimes. Without it, the Judge is just a conventional villain, and this movie's point is that there are no straight villains. Both Todd and the Judge learn, too late, the horrors of having to accept responsibility for their actions, and Todd loses everything in his obsession. This is well brought out by the chilling reprise of the grim yet rollicking Ballad of Sweeney Todd, ending the show with Todd and Lovett rising from the grave to tell us that the end is the same: in a world full of Sweeneys, vengeance begets only vengeance. ""Attend the tale of Sweeney Todd. He served a dark and a vengeful God. To seek revenge may lead to Hell, but everyone does it, and seldom as well as Sweeney, as Sweeney Todd, the Demon Barber of Fleet Street.""",10,pos
28188,3814,I can see little girls enjoying this show  but calling this a family show is ridiculous. I'm amazed ,"I can see little girls enjoying this show, but calling this a family show is ridiculous. I'm amazed how well remembered it is after all these years. It's an extremely unfunny and stupid show about widowed father of three living with his dead wife's brother and his stupid friend from school, and others as the seasons go on. All of the plot lines generally have a really dumb lesson. In the middle of each episode somebody is mad at somebody else and each episode they make up and it ends on a light unfunny joke. As for the actors, I didn't like them either. Bob Saget was painfully unfunny as the dad with the mom responsibilities. Dave Coulier is a one note joke 30 something year old that does cartoon voices and acts like a kid, and he's horrid. John Stamos was the most tolerable character but he was so clichéd it was hard to watch him. The oldest girl, DJ, on the show was a genuinely bad actress and showed no emotion ever. The middle girl Stephanie was too clichéd as the annoying little sister. The youngest girl Michelle showed what bad actresses the Olsen twins were. You can always tell when they are switching them off. The plot lines to too many story lines were so unrealistically stupid it's cringe worthy. This is a ""family"" show that tried to replace any good substance with cuteness and love, and though those are needed for a show about a family they overdid it way too much. This will be remembered as my least favorite sit-com from the 80's and 90's.<br /><br />My rating: Terrible show. TVG 30 mins.",1,neg
49336,8443,My favourite police series of all time turns to a TV-film. Does it work? Yes. Gee runs for mayor and,"My favourite police series of all time turns to a TV-film. Does it work? Yes. Gee runs for mayor and gets shot. The Homicide ""hall of fame"" turns up. Pembleton and nearly all of the cops who ever played in this series. A lot of flashbacks helps you who hasn´t seen the TV-series but it amuses the fans too. The last five minutes solves another murder and at the very end even two of the dead cops turn up. And a short appearance from my favourite coroner Juliana Cox. This is a good film.",9,pos
25563,5584,Do we really need any more narcissistic garbage on the Baby Boomer generation? Technically  I am a B,"Do we really need any more narcissistic garbage on the Baby Boomer generation? Technically, I am a Boomer, though at the time when all the ""idealistic youths"" of the '60s were reading Marx, burning their draft cards, and generally prolonging a war which destroyed tens of thousands of lives; I was still in grade school. But I remember them well, and 9 out of 10 were just moronic fools, who would believe anything as long as it was destructive.<br /><br />This is just another excercise in self-importance from the kids who never really grew up.",1,neg
14327,4387,Great movie  great actors  great soundtrack! I loved it! Settings are perfect  dialogues  situations,"Great movie, great actors, great soundtrack! I loved it! Settings are perfect, dialogues, situations, storyline... all together mixed to give this masterpiece! Clooney and Turturro are magnificent and the Soggy Bottom Boys are simply charming and contagious with their music! :)",9,pos
38302,4833,The legend of Andrei Konchalovsky's towering 4 and a half hour poem to Siberia is not to begin at on,"The legend of Andrei Konchalovsky's towering 4 and a half hour poem to Siberia is not to begin at once, because it must hold back for space, because it takes its time in roundabout explorations of half-remembered childhood memories in a turn-of-the-century backwoods village, yet the movie goes on picking up steam building in emotional resonance as though even the sounds and images which compose it become imbued by sheer association with their subject matter with that quality of fierce tireless quiet dignity that characterizes the Soviet working spirit. Konchalovsky celebrates Soviet collectivity but in an almost revisionist way to paeans like Soy Cuba and Invincible the mood turns somber and reflective. News of the revolution reach the secluded Siberian village through the grapevine. The fruits of its labor reach it only when a world war calls for the young men to enlist. Through all this, Konchalovksy zeroes in on the individual, with care and affection to examine the bitter longing and regret of the woman who waited 6 years after the war for a fiancé who never came back, waited long enough to go out and become a barmaid in a ship with velvet couches and which she quit years later to come back to her village to care for an aging uncle who killed the fiancé's father with an axe, the irreverent folly of the fiancé who came back from the war a hero 20 years too late, came back not for the sake of the girl he left behind but to drill oil for the motherland, the despair and resignation of the middle-aged Regional Party Leader who comes back to his small Siberian village with the sole purpose of blotting it out of the map to build a power plant. The movie segues from decade to decade from the 10's to the 80's with amazing newsreel footage trailing Soviet history from the revolution to war famine and the titanic technological achievements of an empire (terrific visuals here! all kinetic violence and skewed angles and flickering cramped shots of crowds and faces) but the actual movie focuses on the individual, on triumphs and follies small and big. By the second half a sense of bittersweet fatalism creeps in; of broken lives that never reached fulfillment choking with regret and yearning. ""It can't matter"", seems like the world is saying, to which Konchalovksy answers ""it must matter"" because the protagonists keep on trying for redemption.<br /><br />Yet behind this saga of 'man against landscape' something seems to hover, shadowy, almost substanceless, like the Eternal Old Man hermit who appears in every segment to guide or repudiate the protagonists, sometimes a mere spectactor, sometimes the enigmatic sage; a little behind and above all the other straightforward and logical incomprehensible ultimatums challenges and affirmations of the human characters, something invisible seems to lurk. Ghosts of the fathers appearing in sepia dreams, repeated shots of a star gleaming in the nightsky, a curious bear, indeed the Eternal Old Man himself; Konchalovksy calls for awe and reverence before a mystical land of some other order. In its treatment of a small backwoods community struggling against nature progress and time and in the ways it learns to deal with them, often funny bizarre and tragic at the same time, and in how the director never allows cynicism to override his humanism, it reminds me of Shohei Imamura's The Profound Desires of the Gods. When, in a dream scene, Alexei tears through the planks of a door on which is plastered a propaganda poster of Stalin to reach out at his (dead) father as he vanishes in the fog, the movie hints at the betrayal of the Soviet Dream, or better yet, at all the things lost in the revolution, this betrayal made more explicit in the film's fiery denouement. The amazing visuals, elegiac and somber with a raw naturalist edge, help seal the deal. By the end of it, an oil derric erupts in flames and the movie erupts in a wild explosion of pure cinema.",10,pos
26671,3297,Why take a show that millions of us watched and loved as children and make a complete joke of it? Th,"Why take a show that millions of us watched and loved as children and make a complete joke of it? They ask why Hollywood isn't making the money it used to. Because they put out garbage and pay actors huge amounts of money to be garbage men and ask us to pay $10 to see their garbage. The TV show was what it was, good people in bad situations where the good IL' boys come out on top. It wasn't Gone with the Wind but it was fun. This movie is garbage! Hollywood can't come up with anything original so they take something that was good and ruin it for some $$$$. I only hope that this movie makes 10x's less than it cost to make. The only one's to have any fun with this crap are the guys who got to drive the General Lee. The audience is the victim.<br /><br />Don't see it, watch the reruns of the TV show instead. They still hold up 20 years later.",1,neg
47902,9183,This wonderful 1983 BBC television production (not a movie  as others have written here) of the clas,"This wonderful 1983 BBC television production (not a movie, as others have written here) of the classic love story ""Jane Eyre"", starring Timothy Dalton as Rochester, and Zelah Clarke as Jane, is the finest version that has been made to date, since it is the most faithful to the novel by Charlotte Bronte in both concept and dialogue. <br /><br />A classic becomes a classic for very specific reasons; when film producers start to meddle with a classic's very lifeblood then that classic is destroyed. Thankfully the producers of THIS ""Jane Eyre"" approached the story with respect and faithfulness towards the original, which results in a spectacularly addictive concoction that is worth viewing multiple times, to enjoy its multi-layers of sweetness and delight and suspense. The performances are delightful, the music is just right, even the Gothic design of the house and outdoor shots are beautiful, and set the right tone for the production. <br /><br />My only criticism, though slight, is that this version, like every other version ever made of Jane Eyre, ignores the Christian influences that built Jane's character and influenced her moral choices. In today's modern world a woman in Jane's situation wouldn't think twice but to stay with Rochester after finding out he had an insane wife and was still married to her. ""Oh, just get a divorce"", she would say to her man, or she would live in sin with him. But Jane Eyre knew she couldn't settle for this course in life and respect herself. Why? This decision was based on the foundations of the Christian faith she had been taught since childhood, not from the brutal Calvinist Lowood Institution, but from the Christian example of a true friend, Helen Burns, who was martyred rather than not turn the other cheek. Someday I would like to see some version depict these influences a little more fully in an adaptation. A classic novel that ends with the heroine writing ""Even so, come Lord Jesus!"" should not have the foundations of that faith stripped out of it.",10,pos
2579,10465,All I can do is laugh. Wow. I like Jim Wynorski's movies  I really do. I mean  Chopping Mall is a cl,"All I can do is laugh. Wow. I like Jim Wynorski's movies, I really do. I mean, Chopping Mall is a classic. But this, what happened to this guy? He used to make funny horror movies, that tried to be good. But this was hardly even funny...I mean, I guess it was, because I laughed. The villain is incredible. I mean, horrible CGI. It looks...terrible. And the movie has no gore, and no nudity as redeeming qualities. It is rated PG-13. A movie named ""Bone Eater"" you know won't be a blockbuster movie, you know it probably won't have a smart script. A movie like this may rely on gore...but no. It doesn't rely on anything really, it's just...crap. Check it out if you want to laugh, though. But don't expect a good movie. I hope Jim Wynorski goes back to movies like Chopping Mall and Ghoulies IV, because this and Komodo Vs. Cobra ain't cutting it.",3,neg
